{
  "$ref": "#/definitions/products",
  "definitions": {
    "products": {
      "type": "object",
      "properties": {
        "name": {
          "type": "string"
        },
        "slug": {
          "type": "string"
        },
        "categorySlug": {
          "type": "string"
        },
        "subcategorySlug": {
          "type": "string"
        },
        "description": {
          "type": "string"
        },
        "longDescription": {
          "type": "string"
        },
        "price": {
          "type": "number"
        },
        "originalPrice": {
          "type": "number"
        },
        "currency": {
          "type": "string",
          "default": "KES"
        },
        "images": {
          "type": "array",
          "items": {
            "type": "string"
          }
        },
        "brand": {
          "type": "string"
        },
        "sku": {
          "type": "string"
        },
        "inStock": {
          "type": "boolean",
          "default": true
        },
        "attributes": {
          "type": "array",
          "items": {
            "type": "object",
            "properties": {
              "name": {
                "type": "string"
              },
              "value": {
                "type": "string"
              },
              "slug": {
                "type": "string"
              }
            },
            "required": [
              "name",
              "value",
              "slug"
            ],
            "additionalProperties": false
          }
        },
        "seoTitle": {
          "type": "string"
        },
        "seoDescription": {
          "type": "string"
        },
        "primaryKeyword": {
          "type": "string"
        },
        "secondaryKeywords": {
          "type": "array",
          "items": {
            "type": "string"
          }
        },
        "featured": {
          "type": "boolean",
          "default": false
        },
        "$schema": {
          "type": "string"
        }
      },
      "required": [
        "name",
        "slug",
        "categorySlug",
        "subcategorySlug",
        "description",
        "price",
        "images",
        "brand",
        "sku",
        "attributes",
        "seoTitle",
        "seoDescription",
        "primaryKeyword"
      ],
      "additionalProperties": false
    }
  },
  "$schema": "http://json-schema.org/draft-07/schema#"
}